Question,Answer
"In regards to the actor who starred in the 1994 Hong Kong kung fu film directed by Lau Kar-leung and Jackie Chan, when was he/she born?",28 July 1934
"Spin Star is a British television game show that was broadcast on ITV, and was hosted by who?",Bradley Walsh
What film is older The Incredible Journey or The Three Musketeers?,The Incredible Journey
"Who has more scope of proffesion, Hideo Gosha or Dallas M. Fitzgerald?",Dallas M. Fitzgerald
Which Perrot-Warrick Senior Researcher has also given keynote addresses at The Swiss Economic Forum?,Richard Wiseman
"Kim Swift, an American video game designer, was described as one of the most recognized women in the industry by an American digital, print, and e-commerce media company focused on who?",millennials
In what year was the star of a film dramatizing the manhunt for Osama bin Laden born?,1974
The founder of Summerland Tour was born on what date?,"April 12, 1962"
What is the 2010 population of the city where Eteenpäin moved to in 1931?,"195,976"
"Who is an American author and mother of film and television producer Bryan Spears, who wrote a novel based on Britney's life?",Lynne Irene Spears
Are Mary Doria Russell and James Joyce both novelists?,yes
"The ""New York"" class of battleship was a class of ships designed and constructed by the United States Navy, it saw extensive service beginning in the United States occupation of Veracruz, which occurred as a response to the Tampico Affair on which date?","April 9, 1914"
"The Prithvi Theatre, built by Shashi Kapoor and run by his wife Jennifer and daughter Sanjana, is in which Indian city?",Mumbai
"The Lithuanian Crusade was a series of campaigns by the Teutonic Order, and the Livonian Order, they first conquered which tribe  Baltic tribe that lived in the southcentral part of contemporary Latvia, and northern Lithuania?",Semigallians
The footballer sold to Arsenal by Olympique de Marseille in the 2000-01 season was of which nationality?,French
What percentage of CityCenter in Las Vegas does the owner of Gold Strike Casino Resort  own?,50 percent
What is the hometown of the man who owned the club founded by Mickey Gilley?,"Pasadena, Texas"
Who designed the mall where the ballpark Diamond at the Summit is tenatively named for?,designed by Charles N. Agree
"Who was born first, Vladimír Remek or Umberto Guidoni?",Vladimír Remek
The group of people Eka Darville's father descended from first arrived in Jamaica in what year?,1513
The 2017 Dallas Cowboys were the 29th season under the ownership of which American businessman?,Jerral Wayne Jones Sr.
How many Canadians lost their lives in the deadliest conflict in history in absolute terms of total casualties?,"More than 44,000 lost their lives"
"Which company is in the discount travel market, The Walt Disney Company or Priceline.com?",Priceline.com
"Which University is a private Ivy League university, University of Delaware or Columbia University?",Columbia University
Wheal Watkins is a mine in a suburb of which city ?,Adelaide
"Which band formed earlier, Goldfinger or Enter Shikari?",Goldfinger
Jens Risager is a footballer who won five Danish championships with a club on the western outskirts of what city?,Copenhagen
"Who has won more titles, Michael Chang or Ellis Ferreira?",Michael Te-Pei Chang
"What year did the author, who wrote ""The Weapon Master's Choice"" publish his first series?",1977
What are both a Russian Spaniel and an Elo?,breed of dog
"Hum Tum stars which Indian film actor and producer born on August 16, 1970?",Saif Ali Khan
Which Australian cricketer served as an on-field captain in the Glamorgan County Cricket Club?,"James ""Jim"" Allenby"
"the head coach of the LSU Tigers football team is Ed Orgeron, who is currently the head coach at what university?",Louisiana State
Theodosia Burr Alston was the daughter of Aaron Burr and this American patriot who married at what age?,seventeen
"What college is part of the Maine Community College System and is adjacent to a sparkplug lighthouse in South Portland, Maine?",Southern Maine Community College
"What show, whose  cast of celebrities travel to less-habitated, natural places to survive on their own and experience life with local tribes and people, helped make Kim Sung-won a household name?",Law of the Jungle
A Berliner is made from what single-celled microorganisms of the fungus kingdom?,Yeast
Who created the series where Noah Schnapp played Will Byers?,the Duffer Brothers
What worldwide management consulting firm had someone on their board who was the co-founder of the Indian School of Business?,McKinsey & Company
"Which musician is from Canada, Raine Maida or Kevin Parker?",Raine Maida
"What is the title of the Canadian film directed by Jeremy Ma and Angus Ng whose common elements include satire, dark humor, incongruity, the abasement of reason, and controversy regarding the philosophical condition of being ""nothing""?",Criminology
Who was the father of the man born Rudolph Valentino Clay?,"Cassius Marcellus Clay, Sr."
The Sisters stars a Canadian-American actor who is known for his role as Will Truman in what sitcom?,Will & Grace
What nationality are Poe and The Contortionist?,American
Which Irish actor plays the fictional character Stuart Alan Jones from Queer as Folk?,Aidan Gillen
What type air travel package can be purchased at a discounted price bythird largest global airline alliance?,round-the-world ticket
Enzo Amore and Big Cass was at one point managed by an American professional wrestler currently performing on what brand?,SmackDown
The Brittish ruling class were involved in which movement?,Irish independence
"Which family of the plant Tacca leontopetaloides is the common name for some plant species in the genus ""Dioscorea"" (family Dioscoreaceae) that form edible tubers?",Yam
What was the 200 poopulation of the town where James M. Cook died?,"5,141"
"Country living is a magazine that features  Lifestyle and home content,what Ohio town made their 2012 “50 Things To Do This Summer in 50 States” list ?","Dayton, Ohio"
"What term, first applied by the dominant cultural group, reffered to the musician Billy Hughes?",Okie
Joe Dallesandro was a crossover star like the crime boss who established the first of what body?,Commission
Park Sang-myun had a comic role in the 2001 South Korean film directed by whom?,Jo Jin-kyu
The star actress in the thriller The Circle was born in what city?,Paris
Ben Brown kicked a goal in his first game and impressed a coach born in which year ?,1976
"Which board game was centered around the construction of a railroad track: Monopoly Junior, or TransAmerica?",TransAmerica
The Black Windmill is a film produced by a man best known for coproducing what?,Jaws
Which English jurist largely developed legal positivism?,Jeremy Bentham
Are both Tonka and The Happiest Millionaire names of films?,yes
"What is the nationality of this footballer who plays for German club FC Bayern Munich born in 1988, who was added during the 2012–13 FC Bayern Munich season?",Spanish
"What do Mikhail Ilyukhin and Quinton Ramone ""Rampage"" Jackson have in common?",mixed martial artist
Konstantin Saradzhev conducted a number of premieres of works by this Russian composer of the romantic period born in 1840 who was honored by which Russian monarch?,Emperor Alexander III
John Cohen recordered the banjo player from what Kentucky town?,Daisy
"The Sovereign also holds the title Duke of Lancaster, regardless of gender. Who does this title currently describe?",Elizabeth II
"Which film star of the biographical drama ""Genius"", has two Primetime Emmy Awards?",Nicole Kidman
Were both Roger Corman and Jonas Mekas Lithuanian?,no
"Deacon Blue and The National, are bands that have which mutual genre?",rock
Liam Aiken played Klaus Baudelaire in a 2004 film directed by who?,Brad Silberling
"In music, an ostinato, is a motif or phrase that persistently repeats in the same musical voice, usually at the same pitch, well-known ostinato-based pieces include both classical compositions such as Donna Summer, was an American singer, songwriter, and painter, and she gained prominence during the disco era of which late era?",1970s
Is Berea College of the University of Delaware further west?,Berea College
What is the population of the town where Woltermann Memorial Airport is located?,"1,893"
"Which performer from the Dance on Sunset music series had a recurring role on the TV show ""7th Heaven""?",Ashlee Simpson
Are both Veridia and Digital Summer rock bands ?,yes
"Drafted by what team in the sixth round of the 2008 NFL Draft, did the American football safety  who played college football at the college founded in 1882, the program is one of the oldest in college football?",Houston Texans
"Which American man claimed the song ""Exit"" by U2 influenced him to murder Rebecca Schaeffer?",Robert John Bardo
Professional racing driver Stéphane Richelmi was born in which Principality of Monaco?,Monte Carlo
"Which breed of dog is from Scotland, the Pharaoh Hound or the Cairn Terrier?",Cairn Terrier
"When were the Detroit Music Awards, which feature some of Detroit's most notable musical artists like Bob Seger, initially proposed?",1988
"Love Drunk is the second studio album recorded by rock/pop band Boys Like Girls, which song featuring Taylor Swift, from their second studio album ""Love Drunk"" in 2009?",Two Is Better Than One
During the 1998–99 FC Barcelona season what footballer played as a left winger or as an attcking midfielder?,"Boudewijn ""Bolo"" Zenden"
What types of meat other than pork can the primary ingredient of currywurst be made from?,"veal, beef"
"Matthew Perry's co-star in the film ""Almost Heroes"" appeared in what NBC comedy show?",Saturday Night Live
Which French boxer defeated Hussein Ishaish at the 2016 Summer Olympics as an amateur?,Tony Yoka
Evan Buliung played the role of Aragorn in the Toronto production of the most prominent of several theatre adaptations of what kind of book series?,epic high fantasy
"Which has more varieties of beverages, Schweppes or Duke and Sons?",Duke and Sons
Battlefield: 1942: The Road to Rome is an expansion pack which includes a British twin-engine shoulder-winged multi-role combat aircraft served during and after what war?,Second World War
Cottee's and Faygo both produce what?,Beverages
Who owns the company that Lindsay Frimodt did a fashion show with in 2002 and 2003?,L Brands
Victor Spilotro's mobster brother had what nickname?,"""The Ant"""
Glyptotermes minutus is a pest of a flowering tree in the pea family named what?,Fabaceae
"Bob Geldof and Boy George, have which occupation in common?",singer-songwriter
"The Unitarian Church of All Souls, which was built in 1932, was the first congregation of its kind in the city and are unified by their search for what?",spiritual growth
"Sonic Rush Adventure (ソニック ラッシュアドベンチャー , Sonikku Rasshu Adobenchā ) is a 2007 platform game in the ""Sonic the Hedgehog"" series for the Nintendo DS, Sonic the Hedgehog (Japanese: ソニック・ザ・ヘッジホッグ , Hepburn: Sonikku za Hejjihoggu ) is the title character and protagonist of the same name, the series released by ?",Sega
The recording artist whose second single was 21st Century Girl made her acting debut in what 2007 film?,I Am Legend
What country does Macross Frontier and Mai Mai Miracle originate from?,Japan
The American band Catfish Vollins played with was led by who?,George Clinton
"What nationality is Kim Nam-gil, star of 2015's thriller The Shameless?",South Korean
One of the film stars in Terry Jones' 2015 British science fiction comedy was a retired United States Marine Corps what?,Reserve officer
Toy Story 3 and The Apple Dumpling Gang Rides Again are both what kind of movie?,a sequel
What 1998 black comedy film was directed by Peter Berg?,Very Bad Things
Bedtime Stories stars an American talk show host who is known for portraying Andrea Marino in the first season of what show?,Ghost Whisperer
What is the first principle of Kwabena Okyere Darko-Mensah's secondary school?,James Picot
What do Reptiles and Chic have in common?,magazine
What nationality is the player who has won the Ligue 1 Young Player of the Year award twice?,Belgian
University of Houston was defeated 84–75 by Georgetown who was led by a basketball player who played most of his career with what team?,New York Knicks
is ncis new orleans over for the season,Yes
can i have a beard in the military,No
can you contest a scrum in rugby league,Yes
will there be another now you see me movie,Yes
is it possible to have a triangle with two obtuse angles,No
is st george's chapel in westminster abbey,No
is san juan puerto rico in the caribbean,Yes
is the toyota highlander on a truck frame,No
was integration the rule in the northern states,No
do all rhombuses have 2 pairs of parallel sides,Yes
is liquid petroleum gas the same as propane,Yes
can a country have a president and a prime minister,Yes
is nuclear power the same as nuclear energy,No
were greece and rome around at the same time,No
is adjusted gross income the same as taxable income,No
can you drink alcohol with your parents in wisconsin,Yes
are liquor stores in oklahoma open on 4th of july,No
does ethanol take more energy make that produces,No
was the parkers a spin off of moesha,Yes
is a certification of birth the same as a birth certificate,Yes
is z nation a spinoff of the walking dead,No
does the british monarchy have any power in canada,Yes
is dragon ball gt after dragon ball z,Yes
does dory find her parents in finding dory,Yes
is social studies and geography the same thing,No
is there a monthly fee for google voice,No
do you have to have a wicket keeper in cricket,No
is there a main group element in period 6,No
is it lucky to find a four leaf clover,Yes
does shadow of mordor take place before lotr,Yes
does a double barrel surname have to be hyphenated,No
does dan stevens sing in beauty and the beast,Yes
can you own a pet skunk in canada,Yes
is alex from 13 reasons why in nerve,Yes
is a jet engine an external combustion engine,No
is the abdomen the same as the stomach,Yes
is california state route 73 a toll road,Yes
was everything everything based on a true story,No
is top sirloin steak the same as sirloin steak,No
can a wild card team have home field advantage in mlb playoffs,No
will there be a second series of riviera,Yes
is st maarten and st martin the same,Yes
are they making a season 8 of suits,Yes
is the width of your arms your height,Yes
is there a new season of hart of dixie,No
did christine and the phantom have a son,Yes
did they find both halves of the titanic,Yes
is devil may cry 5 set after 2,Yes
is there going to be a season 6 of spirit,Yes
is there such thing as a six leaf clover,Yes
has anyone ever been born with three testicles,Yes
are blade runner and blade runner 2049 connected,Yes
is multithreading useful even on a single processor,Yes
can ingrown toenails come back after being removed,Yes
does washington dc have their own license plate,Yes
has anyone won the grand slam in golf,Yes
is the cecum part of the large intestine,Yes
can a cow get up after being tipped,Yes
are there grizzly bears in the united states,Yes
was guerrilla warfare used in the civil war,Yes
is pva glue the same as elmers glue,Yes
is there a full version of birthday cake by rihanna,Yes
do you have to take the bar exam to practice law,Yes
is there such a thing as dry water,Yes
is the three little pigs a nursery rhyme,No
can there be a word without a vowel,Yes
is there a law that says we have to pay taxes,No
do house and cuddy get back together in season 8,No
is it safe to wash your kid's mouth out with soap,No
does wally west have powers in the flash,Yes
is the black sea connected to the mediterranean,Yes
is every step you take about a stalker,Yes
is dances with wolves supposed to have subtitles,Yes
do gram negative bacteria have a cell wall,Yes
were any bodies found from the edmund fitzgerald,No
are italy in the 2018 world cup finals,No
is congo and democratic republic of congo the same country,No
is the international journal of nursing studies peer reviewed,Yes
has there ever been a tie in baseball,Yes
has russia ever made it to the world cup finals,No
are fighting words protected under freedom of speech,No
will there be a season 4 of game shakers,No
can you buy a gun if you are dishonorably discharged,No
does damon and elena get together in season 3,No
can a catcher block home plate without the ball,No
are any original members of lynyrd skynyrd still alive,No
does the vegas golden knights have a captain,No
are treaties the supreme law of the land,Yes
is the guy from deception really a twin,No
do blue and pink cotton candy taste the same,No
are breakfast lunch and dinner always served in italy,No
can a company be listed in different countries,Yes
is the amur tiger the same as a siberian tiger,Yes
does normal body temperature vary throughout the day,Yes
are dachshunds and weiner dogs the same thing,Yes
were the blossom twins in the archie comics,Yes
do all craftsman tools have a lifetime warranty,Yes
do they still make benson & hedges cigarettes,Yes
can ipad mini 1st generation get ios 10,No
will there be a season 4 of total bellas,Yes
are kidneys on both sides of your body,Yes
is the eye of agamotto the time stone,Yes
is mahi mahi the same as ahi tuna,No
is the county court business centre a real court,No
do all eye doctors use the same eye chart,No
does the e train run on weekends nyc,Yes
is it goaltending if the ball hits the backboard below the rim,No
are babies born with 2 sets of teeth,Yes
is the sort code the same for everyone,No
is age of ultron connected to guardians of the galaxy,Yes
is princeton theological seminary part of princeton university,Yes
is a 10 year old still a child,Yes
did the milwaukee braves ever win the world series,Yes
did mexico made it to the world cup,Yes
can i send something without a return address,Yes
has south africa qualified for the world cup,Yes
has nigeria reached quater final in world cup,Yes
does the xbox 1 play xbox 360 games,Yes
is there a new kung fu panda coming out,Yes
is king's college london part of cambridge university,No
is managerial accounting and management accounting the same,Yes
is it possible for a person to have two different colored eyes,Yes
is a bagel with cream cheese a sandwich,Yes
is it hard to breathe at 7000 feet,Yes
is wrath of the titans a sequel to clash of the titans,Yes
can i use passport card to fly domestically,Yes
is the national anthem and the star spangled banner the same thing,Yes
can the speaker of the house be removed,Yes
can you do surgery on a baby in utero,Yes
is american and australian sign language the same,No
is war room movie based on a true story,No
is it legal to own a gun in chicago,Yes
is there going to be a sequel to the death cure,No
will there be a season 3 of here come the habibs,No
is a catbird the same as a mockingbird,No
is there such a thing as an upside down rainbow,Yes
is drag force the same as air resistance,Yes
do i have to give my name to a police officer,No
are there any animals that are self aware,Yes
is friction tape the same as electrical tape,Yes
is there a fourth season of doctor doctor,No
is the civil rights act in the constitution,No
is the ballroom at the top of the blackpool tower,No
is five nights at freddy's 2 a prequel,Yes
is 4x4 the same as 4 wheel drive,Yes
is profit and loss account same as income statement,Yes
is breaking and entering into a car a felony,Yes
can a president choose not to run for reelection,Yes
is the wizard of oz a disney production,No
is the us the only country to change time,No
is iphone se and iphone 5 the same,No
can you use a credit card number without the card,Yes
is there a republican majority in the senate,Yes
can a fly lay eggs in your skin,Yes
is a midsize car bigger than a full size,No
are there food sources of gamma linolenic acid,Yes
is a cold water bath as good as an ice bath,Yes
has sweden ever been in a world cup final,No
is sunflower oil a type of vegetable oil,Yes
do away goals count in the league 2 playoffs,No
is jurassic world the sequel to jurassic park,Yes
can i have more than one queen in chess,Yes
can all xbox 360 games be played on xbox one,No
can you be born with an extra y chromosome,Yes
is it possible to win chess with only a king,No
is there a remake of my fair lady,No
is there such a place as crabapple cove maine,No
is there a garbage patch in the pacific ocean,Yes
is there a difference between 2 cycle and 2 stroke,No
does steph curry have an olympic gold medal,No
does angel food cake have eggs in it,Yes
is the jaws ride at universal orlando closed,No
is it legal to put a motor on a bicycle,Yes
is there a zoo in las vegas nevada,Yes
have panama qualified for the world cup before,No
are liquor stores open on memorial day oklahoma,No
is pokemon let's go a remake of yellow,Yes
was avatar the last airbender based on a book,No
is the bank of england a private company,No
did anyone from the 1980 us hockey team play in the nhl,Yes
can i turn right on a red light in quebec,Yes
has scotland ever qualified for the world cup,Yes
are the eggs you buy in the store pasteurized,Yes
has germany ever won the eurovision song contest,Yes
is a stem and leaf plot a graph,Yes
can we have multiple foreign keys in a table,Yes
does marley die in a little bit of heaven,Yes
is a half barrel the same as a keg,Yes
is the seven ages of man a sonnet,No
is there such a thing as x ray glasses,No
is a intel core 2 duo processor 64 bit,Yes
is the queen's birthday a public holiday in victoria,Yes
is footlocker and champs owned by the same company,Yes
is a learner's license the same as a permit,Yes
is there any next part of avengers infinity war,Yes
does panic at the disco have an opening act,Yes
did brendon urie wrote death of a bachelor,Yes
is living at high altitude good for you,No
does the drinking age vary from state to state,No
was the soviet union an ally in ww2,Yes
is ghost in the shell based on the anime,No
is there gonna be a season 8 of the walking dead,Yes
is there such a thing as green onyx,Yes
is wells fargo and wachovia the same bank,Yes
is friday night lights movie based on a true story,Yes
is a peace bond an admission of guilt,No
does eating your boogers improve your immune system,Yes
do you have more gas at higher altitudes,Yes
is solid snake and big boss the same person,No
is the show jessie filmed in new york,No
is the song of songs the same as the song of solomon,Yes
is northwest florida state college a 4 year college,Yes
is the movie the quiet place based on a book,No
did spain qualify for the 2018 world cup,Yes
are grey and red squirrels the same species,No
is bermuda off the coast of south carolina,Yes
do litigants on people's court get paid,Yes
is texas the biggest state in the us,No
will there be a adventures of tintin 2,Yes
do will and emma get together in glee,Yes
is the princess and the goblin a disney movie,No
is there going to be a wwe draft in 2017,Yes
does izzie come back in grey's anatomy,No
did sam ever make it home in quantum leap,No
is it possible to get 1 point in football,Yes
is the atomic number equal to the number of protons,Yes
is the tick part of arthur's imagination,No
is this the last season of gsme of thrones,No
can a state supreme court decision be appealed,Yes
does the snake river flow into the columbia river,Yes
can there be outliers in a normal distribution,No
is ready player one based on a true story,No
is there such a thing as a four leaf clover,Yes
can a statutory declaration be used as evidence,Yes
has there ever been a convention of states,No
is south african english similar to british english,Yes
is haroun and the sea of stories a children's book,Yes
is four seasons las vegas part of mandalay bay,Yes
do tom and lynette get back together spoiler,Yes
has there ever been a 5 home run game,No
has university of virginia ever won the ncaa tournament,No
is there any meat in a chiko roll,Yes
is your pupil a hole in your eye,Yes
does the national league play the american league in the world series,Yes
are steel toe boots made to cut toes off,No
is puerto rico the 51st state of the united states,No
does mary ellen become a doctor on the waltons,Yes
is switched at birth based on a real story,Yes
is pine oil and turpentine the same thing,No
are canadian soldiers and mayflies the same thing,Yes
is there goal line technology in the championship,Yes
does a penalty shoot out goal count towards the golden boot,No
will there be a second season of will on tnt,No
does france have a president and prime minister,Yes
does the honda insight need to be plugged in,No
has a category 4 hurricane ever hit the carolinas,Yes
do cathode rays originate from the negative electrode,Yes
do you have to register as a domestic partner in california,Yes
is there a toll both ways on the george washington bridge,No
can i have a cardinal as a pet,No
is a woodchuck and a groundhog the same,Yes
the electronic media in the united states are primarily owned and operated by the federal government,No
is bond paper the same as printer paper,Yes
do callie and arizona get a divorce season 11,Yes
will there be a season 10 of how i met your mother,No
does gemma go to jail in season 3,Yes
is wonder woman and hercules brother and sister,No
did jack die in now you see me,Yes
is the cochlea part of the vestibular system,No
is weed legal in the uk for personal use,No
is season 13 the last season of grey's anatomy,No
is me before you a nicholas sparks movie,No
are hydrogen peroxide and peroxide the same thing,Yes
is liechtenstein the smallest country in the world,No
do jd and elliot get married in scrubs,Yes
can i call an 866 number from canada,Yes
do toronto blue jays play in a dome,Yes
can you restart a heart that has flatlined,Yes
was i will always love you written for bobby brown,No
the climate of western europe is a predominantly a marine climate,Yes
